{
  "adultRejectedCount": 378,
  "candidateChannels": 507,
  "checkedAt": "2026-10-28T11:21:12Z",
  "pendingChanges": 378,
  "policyRejectedCount": 429,
  "safetyQuarantinedCount": 0,
  "schemaVersion": 1,
  "sources": [
    "https://iptv-org.github.io/api/channels.json",
    "https://iptv-org.github.io/api/feeds.json",
    "https://iptv-org.github.io/api/streams.json",
    "https://iptv-org.github.io/api/logos.json",
    "https://iptv-org.github.io/api/countries.json",
    "https://iptv-org.github.io/api/blocklist.json"
  ],
  "status": "SUCCESS",
  "upstreamCounts": {
    "blocklist": 835,
    "channels": 31707,
    "countries": 250,
    "feeds": 45331,
    "logos": 35508,
    "streams": 18146
  }
}
